{
  "schema": "ceratops.github.pr-readiness.deterministic.v1",
  "surface": "pr",
  "description": "Deterministic live GitHub pull-request readiness checks used immediately before merge or auto-merge decisions.",
  "source_docs": [
    "github-contract-source-docs.json:github.graphql.git.ref_rules",
    "github-contract-source-docs.json:github.graphql.repos.pull_request_parameters",
    "github-contract-source-docs.json:github.rest.pulls",
    "github-contract-source-docs.json:github.cli.pr_merge",
    "github-contract-source-docs.json:github.concepts.merge_queue"
  ],
  "free_only": true,
  "mutates": false,
  "evidence": {
    "command": "python -m github_pr_workflow validate --pr NUMBER_OR_URL --cwd PATH --json [--allow-admin-review-bypass]",
    "fields": [
      "number",
      "url",
      "state",
      "isDraft",
      "mergeable",
      "reviewDecision",
      "statusCheckRollup",
      "headRefName",
      "baseRefName",
      "autoMergeRequest",
      "ref.rules.type",
      "ref.rules.parameters.requiredApprovingReviewCount",
      "ref.rules.parameters.requiredReviewThreadResolution",
      "ref.branchProtectionRule.requiresApprovingReviews",
      "ref.branchProtectionRule.requiredApprovingReviewCount",
      "ref.branchProtectionRule.requiresConversationResolution"
    ]
  },
  "checks": [
    {
      "id": "pr.state_open",
      "level_on_drift": "ERROR",
      "expectation": "The PR state is OPEN before a merge or auto-merge decision."
    },
    {
      "id": "pr.not_draft",
      "level_on_drift": "ERROR",
      "expectation": "The PR is not marked draft unless the workflow intentionally stops before merge."
    },
    {
      "id": "pr.mergeable",
      "level_on_drift": "ERROR_OR_WARN",
      "expectation": "The PR is MERGEABLE. CONFLICTING is an error; unknown or delayed mergeability is a warning requiring fresh live state."
    },
    {
      "id": "pr.review_decision",
      "level_on_drift": "ERROR_OR_ADMIN_BYPASS",
      "expectation": "No blocking review decision is present unless direct admin merge is explicitly authorized and the only review blocker is REVIEW_REQUIRED. Requested changes always block direct merge."
    },
    {
      "id": "pr.status_checks",
      "level_on_drift": "ERROR_OR_WARN",
      "expectation": "Visible status checks are passing for direct merge. Failing checks block; pending checks require auto-merge or waiting."
    },
    {
      "id": "pr.auto_merge_request",
      "level_on_drift": "WARN",
      "expectation": "Auto-merge is configured only when GitHub should wait for remaining requirements. Absence is a warning, not a direct-merge blocker."
    }
  ],
  "approved_drift": [
    {
      "id": "direct_merge_without_auto_merge",
      "check_ids": [
        "pr.auto_merge_request"
      ],
      "condition": "The current workflow intends an immediate direct merge after required gates are satisfied.",
      "approval": "Treat missing auto-merge as approved drift for direct-merge workflows."
    },
    {
      "id": "auto_merge_waits_for_pending_checks",
      "check_ids": [
        "pr.status_checks"
      ],
      "condition": "The workflow is intentionally enabling auto-merge while checks are still pending.",
      "approval": "Pending checks are acceptable only when auto-merge is used and no failing checks are present."
    }
  ],
  "non_deterministic_review_file": "github-pr-readiness-nondeterministic-contract.json"
}
